Company, Region, Phone, Contact, Availability, Notes
O'Hare Towing Service, IL, (630) 257-3334, Dispatch, 24/7, Chicagoland heavy-duty and light-duty coverage along I-55
United Road Towing, CA, (310) 527-6040, Dispatch, 24/7, South Bay and LA County rotation partner
Classic Towing, TX, (214) 941-7727, Dispatch, 24/7, Dallas-Fort Worth heavy-duty specialists
All City Towing, AZ, (480) 833-7278, Dispatch, 24/7, Valley-wide response across Phoenix and Mesa
Guardian Towing, WA, (206) 767-4665, Dispatch, 24/7, Seattle metro and Sea-Tac airport corridor
Citywide Towing Service, MA, (617) 338-1644, Dispatch, 24/7, Boston metro quick response along I-93/I-90
