Company,Region,Phone,Contact,Availability,Notes
Rapid Tow Services,TX,"(214) 555-2011",Maria Lopez,24/7,"Covers Dallas/Fort Worth with GPS-enabled fleet"
Interstate Recovery,NV,"(775) 555-4432",Steven Park,Daytime,"Dispatch within 45 minutes across Reno and Sparks"
Coastal Haul & Tow,FL,"(904) 555-8870",Kelly Ramirez,24/7,"Supports long-haul requests up to 150 miles"
Peak Response Towing,CO,"(720) 555-3902",Jordan Smith,Nights/Weekends,"Preferred partner for mountain corridors"
Metro Hook & Lift,IL,"(312) 555-1120",Dana Patel,Business Hours,"City-certified for downtown Chicago"
